job_id,company_name,title,description,location,company_id,views,formatted_work_type,application_type,formatted_experience_level,posting_domain,sponsored,zip_code,ingestion_time
3903877649,TEKsystems,Fire Alarm Service Technician,"Description 

The Fire Alarm and Security System Technician is responsible for troubleshooting low voltage Fire Alarm and Security Systems and resolving any problems. This position requires a thorough understanding of fire alarm and security products, supporting software, and electrical systems. Essential Duties and Responsibilities Installation, Service, and Inspections of Fire Alarms and associated systems Completion of all necessary paperwork associated with service and inspections Communicate with customer before and after any call to explain work performed Ensure timely job completion Daily communications with Project Manager and/or Schedule Coordinator on inspection or project delays, requirements and general status of job Take turns in On-Call rotation May Mentor Fire and / or Security technicians on tools and technology

 Skills 

fire alarm, service, troubleshooting, access control, install, low voltage, cable, alarm systems, fasa

 Top Skills Details 

fire alarm,service,troubleshooting

 Additional Skills & Qualifications 

Familiarity with NFPA 72, Florida Fire Prevention Code, and local building codes Minimum 2 years’ field experience in inspection, repair, and installation of fire alarm and security system systems Extensive knowledge of low voltage systems Experience working with Fire-Lite and Notifier brands of equipment Ability to read blueprints Proficient in the use of computers and smart phones, specifically Microsoft Windows, Microsoft Office, Apple iOS, and Google Android High Level of Troubleshooting and Problem-Solving Skills Strong verbal and written communications skills required Organized, motivated, and able to work with minimum supervision Valid driver’s license with good driving record

 Experience Level 

Intermediate Level

 About TEKsystems 

We're partners in transformation. We help clients activate ideas and solutions to take advantage of a new world of opportunity. We are a team of 80,000 strong, working with over 6,000 clients, including 80% of the Fortune 500, across North America, Europe and Asia. As an industry leader in Full-Stack Technology Services, Talent Services, and real-world application, we work with progressive leaders to drive change. That's the power of true partnership. TEKsystems is an Allegis Group company.

The company is an equal opportunity employer and will consider all applications without regards to race, sex, age, color, religion, national origin, veteran status, disability, sexual orientation, gender identity, genetic information or any characteristic protected by law.","Boynton Beach, FL",2152.0,3.0,Full-time,OffsiteApply,Entry level,jsv3.recruitics.com,0,33426.0,2025-11-18 03:44:52
3901913558,LGC,QC Lab Data Specialist,"Company Description

ABOUT LGC CLINICAL DIAGNOSTICS:

LGC Clinical Diagnostics develops and manufactures a comprehensive portfolio of catalogue and custom-developed diagnostic quality solutions and component materials for the extended life sciences industry. We partner with IVD assay developers, pharmaceutical, CRO and academic institutions in commercialization activities across the entire diagnostic pipeline. Laboratorians and diagnostic professionals across disciplines of clinical chemistry, immunochemistry, serology, molecular diagnostics, and clinical genomics rely on LGC’s products to support accurate and reliable diagnostic results.

Our operating entities include Maine Standards Company, SeraCare Life Sciences, and Technopath Clinical Diagnostics, which are in vitro diagnostics (IVD) manufacturers of quality measurement tools (calibrators, controls, linearity, EQA/PT, biological materials), the Native Antigen Company, which is a manufacturer and supplier of viral antigens and LGC Proficiency Testing a global leader in PT schemes. We operate FDA-registered and ISO 13485-accredited facilities in Maine (USA), Massachusetts (USA), Maryland (USA), Tipperary (Ireland), ISO 9001-accredited facility in Oxford, UK, and Traverse City, Michigan US.

Each day, our world-class staff, scientific expertise, operational efficiency, and superior quality systems are ready to support the range of advanced technologies that collectively improve patient outcomes - from the widely adopted and established through to cutting-edge NGS and precision diagnostics.

Job Description

The QC Lab Data Specialist position will perform a critical role by following standardized procedures, safety guidelines, and instructions to perform data workflow tasks in our Quality Control Lab. The QC Lab Data Specialist organizes samples submitted by our Manufacturing and R&D Teams for testing, orders additional testing as needed, enters analyzer result data into spreadsheets and other data systems, and communicates the status of samples moving through the QC workflow. A high level of organizational skills and attention to detail desired. May perform a variety of supporting tasks. A limited degree of creativity, adaptability, flexibility, and cooperation is required.

Key Responsibilities

Data entry of QC results into necessary systems. Follows all safety guidelines presented by the department and safety officer. Work with team from QC, Manufacturing, and R&D to ensure effective communication of results. Focus on customer service and teamwork among LGC QC, LabOps and R&D team members. Work with QC to plan daily testing and ensure samples are moving through workflows in a timely fashion. Able to evaluate processes and workflow for inefficiencies and suggest improvements. Excellent attention to detail is essential to succeed in this role. Able to work independently and as part of a team. Excellent verbal and written communication skills are essential, including the ability to communicate in a clear, concise manner. Must be a team player with excellent interpersonal skills. Physical Demands

The physical demands are representative of those that must be met by an employee to successfully perform the essential functions of this job. Reasonable accommodations may be made to enable individuals with disabilities to perform the essential functions.

Requires prolonged sitting and working at a computer monitor. Repetitive motion using a keyboard for long periods of time. May occasionally be required to lift and move material weighing up to 10 lbs.

Work Environment

The work environment characteristics are representative of those an employee encounters while performing the essential functions of this job. Reasonable accommodations may be made to enable individuals with disabilities to perform the essential functions. 

Agreeable work environment typical of an open office setting with some exposure to noise from office machines. Will require occasionally working in a clinical laboratory area with closed bottles containing biomedical materials when transporting, organizing samples

Qualifications

Requires a high school education, other further education is beneficial in particular with data systems. Experience working with data in fast-paced environments. Exceptional organizational and multitasking skills are requiredDemonstrated skills in Excel necessary, advanced skills beneficial. Familiarity with Word also necessary to succeed in this role. 

Additional Information

ABOUT LGC:

LGC is a leading, global life science tools company, providing mission-critical components and solutions into high-growth application areas across the human healthcare and applied market segments. Its high-quality product portfolio is comprised of mission-critical tools for genomic analysis and for quality assurance applications, which are typically embedded and recurring within our customers’ products and workflows and are valued for their performance, quality, and range.

OUR VALUES

PASSIONCURIOSITY INTEGRITYBRILLIANCERESPECT

EQUAL OPPORTUNITIES 

LGC strongly believes that every job applicant and employee should be valued for their individual talents regardless of age, disability, race, color, ethnic or national origin, sex, sexual orientation, gender reassignment, marital or civil partnership, pregnancy or maternity, religion, or belief. Short listing, interviewing and selection will always be carried out without regard to gender, sexual orientation, marital status, color, race, nationality, ethnic or national origins, religion or belief, age, or trade union membership.

For more information about LGC, please visit our website www.lgcgroup.com

#scienceforasaferworld","Cumberland, ME",410756.0,2.0,Full-time,ComplexOnsiteApply,Entry level,jobs.smartrecruiters.com,0,4021.0,2025-11-18 03:44:52
3904004164,Spectrum Community Solutions,Outside Sales Representative | MTS,"Sells products and services to customers in assigned non-bulk multi-dwelling units (MDU) areas/properties with 20+ doors through door-to-door solicitation and lobby events.

Actively and consistently support all efforts to simplify and enhance the customer experienceMeets established objectives relative to monthly sales goals and increased sales volume and penetration through assigned leads and assigned property portfolioSolicits residential customers through door-to door solicitation and lobby eventsGenerates incremental revenue from existing customers by adding new/additional servicesResponds to customer problems and complaints according to established company policy; follows through to ensure issues are satisfactorily resolvedMaintains a well-informed knowledge base of competitors activities throughout assigned territory; informs manager of any changing competitive pricing programs or marketing directionsAttends and actively contributes to sales meetings and training programsAccurately completes all necessary paperwork to support sales activities in a manner consistent with quality control guidelines, including dispositions, sales orders and sales reportingCollect and account for funds and provide receipts according to Company policy and guidelines

Required Qualifications

Knowledge of cold call sales skills, persuasion, and clear communication skillsAbility to travel (including during inclement weather) to and from assigned territories and company facilities using a reliable personal vehicleAbility to work outside for extended periods in any season and/or during inclement weatherFamiliarity with computer operating systems, a myriad of consumer and commercial communications devices (e.g., PDAs, smartphones, routers, modems, converters, and wireless devices), and computer software applicationsValid driver's license with a satisfactory driving record within Company required standards

Required Education

High School Diploma or equivalent work experience

Required Related Work Experience And Number Of Years

Experience in sales or customer service – 0 to 6 months

Preferred Qualifications

Knowledge of communications technologies and services, with an emphasis on data networking fundamentalsKnowledge of cable or telecommunications servicesExperience with consumer education of products and servicesSuccess in a previous sales position, prospecting or cold calling; direct sales experience is preferred, but not required.

Preferred Related Work Experience And Number Of Years

Sales or relevant work experience – 1+

Working Conditions

Spends approximately 80% of time in outside environment for extended periods of time in any season with potential exposure to inclement weatherMust be able to lift 10-20 pounds for 20 - 30 feet (digital boxes, etc.)Exposure to moderate noise levelsMust be able to work evenings and weekendsVariable hours: may include weekends, holidays, and split days off

Physical And Mental Requirements

Physical Requirements

Walking door to door for extensive periods through local communities

Mental Requirements

Ability to complete documentation accuratelyAbility to build mutually beneficial relationships with all management at assigned propertiesAbility to communicate orally and in writing in clear and straightforward mannerAbility to maintain confidentialityAbility to deal with the public in a professional mannerAbility to maintain high level of self-motivationAbility to maintain favorable relations with subscribers, vendors and employees within the service areaAbility to prioritize and organize effectivelyAbility to use personal computer and software applications

SMD311 2024-32353 2024

Here, employees don’t just have jobs, they build careers. That’s why we believe in offering a comprehensive pay and benefits package that rewards employees for their contributions to our success, supports all aspects of their well-being, and delivers real value at every stage of life.

A qualified applicant’s criminal history, if any, will be considered in a manner consistent with applicable laws, including local ordinances.

The pay for this position has a salary range of  $50,000.00 to $50,000.00. The actual salary offer will carefully consider a wide range of factors, including your skills, qualifications, experience and location. Also, certain positions are eligible for additional forms of compensation such as bonuses.

In addition, this position has a commission earnings target starting at  $45,000.

Get to Know Us Charter Communications is known in the United States by our Spectrum brands, including: Spectrum Internet®, TV, Mobile and Voice, Spectrum Networks, Spectrum Enterprise and Spectrum Reach. When you join us, you’re joining a strong community of more than 100,000 individuals working together to serve more than 32 million customers in 41 states and keep them connected to what matters most. Watch this video to learn more.

Who You Are Matters Here We’re committed to growing a workforce that reflects our communities, and providing equal opportunities for employment and advancement. EOE, including disability/vets. Learn about our inclusive culture.","Chatsworth Lake Manor, CA",87101907.0,4.0,Full-time,OffsiteApply,Entry level,jobs.spectrum.com,0,91311.0,2025-11-18 03:44:52
3904955943,RightWorks,Category Manager - 1437184,"The Position:

This is a newly developed position that is appropriate for an experienced Category Manager with global exposure to Engineering and Construction Services across EPC and EPCM. Over the next three years, capital expenditures are estimated to reach $1.5 billion per year.

This position reports to the Director of Procurement, Corporate Services, and is part of the Corporate Services Procurement team. The Engineering/Technical Services Category Manager will be responsible for designing and implementing category strategy in accordance with the Procurement Department's objectives. This position will serve as a key strategic partner to site buyers, capital teams, and internal customers, managing total cost while guaranteeing the procurement of quality services to fulfill the demands of the organization. The position will assist with operations and capital expansion globally. Travel will be roughly 25%, with more initially required. The Category Manager will be in charge of designing and implementing procurement best practices, which will have an impact on policy, processes, tools, templates, and supplier management practices, as well as driving continuous improvement and cost savings.

The Responsibilities:

 Collaborate with key business stakeholders to develop a category strategy for the fiscal year and beyond (1-3 years) to manage key supplier relationships and/or projects that produce company value. Achieve and report cost savings, as well as measure other category improvements related to sourcing efforts, such as company-wide sustainability targets. Leverage spending and bargain to get the lowest Total Cost of Ownership (TCO) for the company. Train, mentor, and coach assistant category managers. Collaborate with Procurement Analysts to do detailed spend analysis by category or subject matter in order to comprehend and control complex areas of expenditure. Work with key functions such as Legal, Human Resources, and Finance, as well as business unit stakeholders, to ensure that sourcing operations adhere to appropriate company policies and guidelines. Manage global and regional RFI/RFQ/RFP initiatives as part of the organization's competitive bidding strategy, including vendor evaluation, selection, and implementation activities via Procurement technology platforms. Cross-functional collaboration to manage supplier relationships in order to limit risk and assure the business's consistency of value and quality. Work with the Supply Chain Center of Excellence to drive and promote Procurement practices, procedures, and technology adoption. Maintain current understanding of sourcing, category best practices, and market statistics. Drive and implement best practices in Procurement, Category Management, and Supplier Relationships across Regional Procurement Service teams. Establish and manage category councils across various business divisions and teams. Hold quarterly business reviews (QBRs) with suppliers, creating key performance indicators (KPIs) and best practices for supplier performance (i.e. on-time delivery), cost reductions, and other value-added services. Experience negotiating contract legal terms, engineering agreements (including hourly billing rate formulation), category strategy development, and negotiating international agreements.


Qualifications:

 Thorough understanding of Engineering Services / EPC / EPCM contract negotiations. 6+ years of strategic sourcing/category management and procurement experience with growing responsibility and growth. Strong influencing abilities Innovative thinking and strategic agility/perspective Excellent data analysis skills Experience with category management frameworks and supplier relationship management Comprehensive understanding of the S2P (Source to Pay) process Strong decision-making abilities and business acumen Interpersonal skills and ability to collaborate with stakeholders and multiple functional groups on projects/programs Ability to handle ambiguity Procurement spend data management and sourcing/contracting tools experience a plus Knowledge of Lean and Change Management. Procurement certifications (SCMP/CPM/CPSM) Experience with global / large Engineering / EPC / EPCM firms.


","Charlotte, NC",11009726.0,5.0,Full-time,OffsiteApply,Associate,app.loxo.co,0,28202.0,2025-11-18 03:44:52
3889121833,Provider Solutions & Development,Nurse Practitioner Telehospitalist,"Providence Virtual Care & Digital Health is seeking a dynamic and energetic ARNP with outstanding people skills to join our growing Hospital at Home program. We provide hospital-level care in patients’ homes. It’s very patient-centered work as part of an engaged, multi-disciplinary team.The Hospital at Home program is based out of Providence St. Peter in Olympia, WA. Some work will also be remote, as the team continues to grow and evolve. All necessary equipment and technology are provided. Take advantage of this amazing opportunity to be a part of an outstanding team!

Current standard shifts are 10 or 12 hours in lengthSee patients remotely and in their homes when neededWe love our patients and are looking for someone who is very caring and patient-focusedThe ability to work well with a team is key because we’re fun and committed to making Hospital at Home awesome!5+ years acute care experience strongly desiredCompensation is between 126,417 and 158,838 per yearThe compensation amounts listed may include productivity or quality/service incentives, call pay, extra shift incentives, as applicable to the position. In addition, providers may have CME benefits available to them.

Where You’ll Work

Providence St. Peter Hospital is a 390-bed regional referral center on a 173-acre campus in downtown Olympia. Listed in U.S. News and World Report as one of the top 5 Best Regional Hospitals in Washington for 2019, St. Peter offers a respected family medicine residency program and has a Level III trauma center, as well as a 24-hour stroke service. Providence St. Peter has earned Nursing Magnet status and been ranked in the top 4 percent of hospitals in the nation.

Where You’ll Live

Olympia is on the southern tip of scenic Puget Sound, which offers an abundance of activities from beachcombing to salmon fishing to sailing. Olympia and its primary neighboring cities of Tumwater and Lacey have a population of 250,000, offering an abundance of culture, entertainment and an outstanding school system from elementary through university, including The Evergreen State College and Saint Martin’s University.

Who You’ll Work For

Providence is a nationally recognized, comprehensive health care organization spanning seven states with a universal mission – to provide compassionate care to all who need its services, especially the poor and vulnerable. Its 119,000-plus caregivers/employees serve in 51 hospitals, more than 800 clinics and a comprehensive range of health and social services. Providence: one name, one family, one extraordinary health system.

Check out our benefits page for more information.

Equal Opportunity Employer including disability/veteran

","Olympia, WA",18577044.0,4.0,Full-time,SimpleOnsiteApply,Mid-Senior level,rr.jobsyn.org,0,98501.0,2025-11-18 03:44:52
