job_id,company_name,title,description,location,company_id,views,formatted_work_type,application_type,formatted_experience_level,posting_domain,sponsored,zip_code,ingestion_time
3905380285,BAYADA Home Health Care,RN 1:1 - Home Care,"Come for the Flexibility, Stay for the Culture

Needing more ‘life’ in your work-life balance? Apply to our talent network today!

BAYADA Offers Our RNs

One on one careFlexible scheduling based on your preferencesWeekly payPreventive Care Coverage for ALL employees (PRN included)PTOShort commute times – we match you with cases nearest youMedical, Dental, and Vision benefitsCompany-paid life insuranceEmployee Assistance Program401KCareer advancement and training

BAYADA Home Health Care was founded on the principle that health care gets better when clients get better care at home—the place they most want to be. Delivering care is our highest priority and greatest joy.

How We Prepare Our RNs For Success

Paid training from day 1 in the office, in the home, and onlinePractice with award-winning adult and pediatric Simulation labsAround the clock clinical support by phoneElectronic charting using AlayaCare

We care for clients of all ages, diagnoses, and acuity levels. We offer a multitude of paid training to our nurses to feel comfortable and competent on their first shift.

Available RN Shifts

8, 10 or 12 hour shifts1st, 2nd or 3rd shiftWeekdays and Weekends

Requirements

Current valid nursing license in the U.S.Graduation from a qualified nursing program

Pay: [$33- $37 per hour]

Apply now to join our team!

NER-NJ-RX

As an accredited, regulated, certified, and licensed home health care provider, BAYADA complies with all state/local mandates.

BAYADA Home Health Care, Inc., and its associated entities and joint venture partners, are Equal Opportunity Employers. All employment decisions are made on a non-discriminatory basis without regard to sex, race, color, age, disability, pregnancy or maternity, sexual orientation, gender identity, citizenship status, military status, or any other similarly protected status in accordance with federal, state and local laws. Hence, we strongly encourage applications from people with these identities or who are members of other marginalized communities.","Chester, NJ",19472.0,3.0,Full-time,OffsiteApply,Mid-Senior level,jsv3.recruitics.com,0,7930.0,2025-11-18 03:44:52
3905334648,Madison Reed,"Shift Lead, Licensed Cosmetologist","Shift Lead, Hair Color Bar

Madison Reed’s Hair Color Bar Shift Leads are responsible for ensuring the client experience is seamless from arrival to departure. This role is important to our team members' performance and clients’ Hair Color Bar experience by recognizing the unique and diverse needs of each client. The Shift Lead is the expert on Madison Reed, including consultations, color services, hair care products, unlimited roots membership program and subscriptions while providing services to Hair Color Bar clients and leading the team.

What you’ll do:

Actively works in the Hair Color Bar providing all color services, including but not limited to; all over color, roots treatment, roots and gloss treatment, highlights, toning glaze treatment, and blowout servicesPerforms additional services as needed, such as, consultations, shampoo and blowout services, and as well as retail product recommendationsEngages with clients to deliver a distinct and delightful client experience, mapped to their diverse needs, resulting in future client engagement with the Hair Color BarLeads the team, at times without the Manager, by managing and guiding the team, valuing their ideas and insights to expand the positive experience for the clientCoaches and develops team members to ensure the highest level of team culture, client satisfaction, and Hair Color Bar performance through aligning individuals’ unique talents and abilities with the most relevant responsibilitiesSupports as needed front-end operations while adhering to all company standard operating procedures, including but not limited to buy online pick up in store (BOPIS) and assisting clients with their retail ordersGenerates incremental revenue for the Hair Color Bar by building the service order through additional services, sales of unlimited roots memberships, subscriptions, hair care, and home hair care products and accessoriesUtilizes all Madison Reed systems to efficiently manage the business and drive retail and service sales, including service capacity, digital waitlist and buy online pick up in store (BOPIS)Exhibits sales and service behaviors in all interactions and communication with clientsRegularly meets and exceeds daily, weekly, and monthly sales goalsDemonstrates a positive and cooperative approach towards teammatesAbility to work evenings, weekends and holidays as needed


Who you are:

Based on state requirements, Cosmetology/Hairdressing license required hours completed to perform hair color services1+ years of operational management experience, with 2+ years of experience working in a service-oriented businessOutstanding communication, problem solving & troubleshooting skillsAbility to multitask in a fast-paced environmentExceptional organizational skills with high attention to detailComputer skills and POS (Point of Sale) system experience are desired


By applying for this job, I agree to receive text (SMS) messages, including via autodialer, related to my application and, if I am hired, to my employment and Madison Reed business. Message and data rates may apply. Text ""STOP"" at any time to cancel.

Physical Demands:

While performing the duties of this position, team members will regularly stand/walk for 4 consecutive hours or more at a time; regularly bend and twist at the waist, manipulate fingers and hands, bend wrists and arms, reach with hands and arms, speak, see, hear, and lift/move up to 3 pounds. May on occasion sit, kneel, stoop, crouch, and lift/push/pull up to 20 pounds.

Big On Benefits

The Perks? Glad you asked...

Comprehensive Medical, Dental, and Vision Benefits Generous Paid Time Off programCompany Paid Short and Long Term Disability and Life InsuranceHSA Employer Contributions and FSA Options401k ParticipationLearning and Education ProgramsMadison Reed Gratis + Discounts on Hair Color Bar Services and ProductsCompany Sponsored Events + Surprise and DelightsBut wait, there’s more…


We are Madison Reed.

We’re disrupting a $50 billion industry.

Since 2013, we’ve offered our clients the option to truly own their beauty with a revolutionary choice—your place or ours? Home or Hair Color Bar? Our professional hair color is truly omnichannel, with the option to order or subscribe through our website, pick up in-store at our Hair Color Bars, or make an appointment at one of our Hair Color Bar locations. At our Hair Color Bars, clients can choose from a variety of color services from licensed cosmetologists—permanent hair color, roots only, hair gloss, highlights, blowout services and more. With our men’s line launched in 2020, we’re shaking up the $50 billion hair care industry with products that continue to raise the bar for doing hair at home.

We live our values.

Here at our San Francisco headquarters and in every Hair Color Bar, we truly live our values—Love, Joy, Courage, Responsibility, and Trust. Our values inform everything we do, from how we treat our clients to how we treat every member of our fast-growing team. Our founder & CEO, Amy Errett, has fostered a one-of-a-kind culture based on transparency, accountability, and fun; where diversity and inclusion are of utmost importance and every team member feels supported to succeed.

We are hair color that breaks the rules.

Our commitment to the ultimate client experience, paired with our dedication to product innovation and the latest beauty technology, has attracted a devoted, consistently-growing base of fans, converts, and color evangelists. We love what we do—and it shows.

Join us in our mission to live life colorfully and make personal care more personal.

ALERT: We are aware of a scam whereby imposters are posing as employees from Madison Reed. Beware of anyone requesting financial or personal information.

At Madison Reed, we take pride in creating a best-in-class candidate experience. During the recruitment process, no recruiter or employee will request financial or personal information (Social Security Number, credit card, driver’s license, or bank information, etc.) from you via text or email. If you are suspicious of a job posting or job-related email mentioning Madison Reed, let us know by contacting us at hiring@madison-reed.com

Information for Recruiters: Madison Reed only accepts resumes directly from candidates. Madison Reed does not accept unsolicited resumes from staffing vendors, including recruitment agencies and/or search firms, and does not pay fees to any such vendors for any unsolicited resumes.

Madison Reed is proud to be an Equal Opportunity Employer. We do not discriminate on the basis of race, color, ancestry, national origin, religion or religious creed, mental or physical disability, medical condition, genetic information, sex (including pregnancy, childbirth and related medical conditions), sexual orientation, gender identity, gender expression, age, marital status, military or veteran status, citizenship, or other characteristics protected by state or federal law or local ordinance. Madison Reed has a zero tolerance for discrimination, racism, xenophobia or misogyny in any form in our workplace. We strive to create a workplace where everyone feels empowered to bring their full, authentic selves to work every day.

Pursuant to the San Francisco, Los Angeles, and New York City Fair Chance Ordinance, we will consider for employment qualified applicants with arrest and conviction records.","Davie, FL",3066118.0,4.0,Full-time,OffsiteApply,Mid-Senior level,app.careerpuck.com,0,33837.0,2025-11-18 03:44:52
3903840684,Enterprise Bank & Trust,Teller I,"Enterprise Bank & Trust was founded in the spirit of entrepreneurship and community. From the small mom-and-pop coffee shop to the large construction company that employs local people, our goal is to help businesses succeed and our communities thrive. 

With offices in Arizona, California, Florida, Kansas, Missouri, New Mexico, Nevada and Texas, we’re strong, growing and committed to supporting the communities we serve. We extend this commitment to the community to our associates, offering annual paid volunteer time off and charitable-matching opportunities. Voted a Best Bank to Work For by American Banker for multiple years, we offer our associates an array of benefits and the opportunity to chart their own career path with us. Join us in the pursuit of our mission to guide people to a lifetime of financial success, and enjoy a career filled with professional growth opportunities, interesting colleagues and the satisfaction of supporting our communities. 

Together, there’s no stopping you!

Job Title

Teller I

Summary

Job Description:

Provides prompt, efficient, and friendly services to clients. Performs a variety of duties in processing business and banking transactions, including at times heavy cash handling responsibilities.

Essential Duties And Responsibilities

Handles multiple transaction types such as, accepts checks for cash and deposit, verifies cash, endorsements, and issues receipts; accepts deposits including bulk coin/currency, savings and checking deposits, issue cashier checks, and currency orders and shipmentsMaintains proper cash levels in drawers and is responsible for keeping cash secureResponsible for daily balancing of cash drawerResponsible for handling over/short account in acceptable approved mannerResponds to clients’ needs and inquiries in a courteous and friendly mannerAbility to balance ATM, Vault, Coin and cash GL AccountsPerforms minor account maintenance tasks, as trained and assigned per branch needs, including but not limited to, address changes, debit card maintenance & check orderingRefers customers to an internal team of experts when additional financial goals and needs are recognizedEducates clients on bank technology, such as mobile and online banking, ATM and ITMAssists branch and fellow team members by achieving goals and sharing responsibility of daily tasksEnsures safe and sound banking practices, including adherence to all applicable laws and regulationsAssist in opening and closing the branch, following procedures set by corporate securityPerforms other miscellaneous duties as assigned

Qualifications

Strong math and problem solving skillsExcellent interpersonal and customer service skills with the ability to cross sale products and servicesMust maintain confidentiality of client transactions and bank recordsTeam-oriented, possess a positive attitude and work well with othersGood phone voice with professional and well-groomed appearanceAbility to interview customers and understand requestsAbility to operate standard office equipment, such as, computer work stations, typewriters, calculators, and copierAbility to prioritize; handle multiple tasks; and work independentlyStrong organizational skills and detail-oriented with high degree of accuracyThorough knowledge of bank operations, products, and services offered at the bankKnowledge of banking laws and regulations including the Bank Secrecy Act

Supervisory Responsibilities

None

Education And/or Experience

High School diploma or equivalent plus one year of cash handing experience preferred

Computer And Software Skills

Basic knowledge of Microsoft Word & ExcelBankwayInterceptImage CentreQ2 AssistPositive PaySalesforce

Certificates, Licenses And Registrations

Notary, if needed

Working Conditions

Extensive periods of standingAbility to lift 35 lbs.Constant judgment and concentrationFrequent talking and listeningAwareness of location and operation of surveillance equipment and how it impacts the branch

Equal Opportunity Statement

Enterprise Bank & Trust is committed to helping individuals with disabilities participate in the workforce and ensuring equal opportunity to apply and compete for jobs. If you need an accommodation in order to apply for a position at Enterprise Bank & Trust please contact Human Resources at hr@enterprisebank.com.

Enterprise Bank & Trust is committed to managing our business and community relationships in ways that positively impact our associates, clients, and the diverse communities where we work and live. We are proud to be an Equal Opportunity Employer. All qualified applicants will receive consideration for employment without regard to age, race, color, religion, sex, national origin, sexual orientation, gender identity or protected veteran status and will not be discriminated against on the basis of disability. All employment offers are contingent upon the applicant successfully completing both drug and background check screenings. If you would like more information about your EEO rights as an applicant under the law, please download the Equal Employment Opportunity is the Law poster HERE.","Olathe, KS",29579.0,4.0,Full-time,OffsiteApply,Entry level,osv-enterprise.wd1.myworkdayjobs.com,0,66061.0,2025-11-18 03:44:52
3904967161,BioSpace,"Director, U.S. Therapeutic Area Policy, Virology","United States - District of Columbia - WashingtonUnited States - California - Foster City

Gilead Sciences, Inc. is a research-based bio-pharmaceutical company that discovers, develops and commercializes innovative medicines in areas of unmet medical need. With each new discovery and investigational drug candidate, we seek to improve the care of patients living with life-threatening diseases around the world. Gilead’s therapeutic areas of focus include HIV/AIDS, liver diseases, cancer and inflammation, and serious respiratory and cardiovascular conditions.

Making an impact on a global scale

Inclusion is one of the company’s five core values. That’s because we know that we are stronger and more innovative at Gilead when we are informed by a diverse set of backgrounds, experiences and points of view. Gilead Sciences is a biopharmaceutical company that discovers, develops and commercializes innovative therapeutics in areas of unmet medical need. The company's mission is to advance the care of patients suffering from life-threatening diseases worldwide.

When you join Gilead, you join our mission to change the world by enabling people to live healthier and more fulfilling lives. Come join a mission-driven bio-pharmaceutical organization that values inclusion and diversity, has a strong portfolio of products, and is constantly #CreatingPossible

For Current Gilead Employees And Contractors:

Please log onto your Internal Career Site to apply for this job.

At Gilead, we're creating a healthier world for all people. For more than 35 years, we've tackled diseases such as HIV, viral hepatitis, COVID-19 and cancer - working relentlessly to develop therapies that help improve lives and to ensure access to these therapies across the globe. We continue to fight against the world's biggest health challenges, and our mission requires collaboration, determination and a relentless drive to make a difference.

We empower our leaders to step up, share ideas, listen, learn, and lead. We're welcoming bright, diverse, and imaginative minds; we're nurturing them to foster an environment of inclusion and growth where innovation is encouraged. We expect our people leaders to model that environment, and to focus on creating inclusion, developing talent, and enabling teams.

Every member of Gilead's team plays a critical role in the discovery and development of life-changing scientific innovations. Our employees are our greatest asset as we work to achieve our bold ambitions, and we're looking for the next wave of passionate and ambitious people ready to make a direct impact. Join Gilead and help create possible, together.

Job Description

Gilead Sciences is a biopharmaceutical company that discovers, develops, and commercializes innovative therapeutics in areas of unmet medical need. The company's mission is to advance the care of patients suffering from life-threatening diseases worldwide. Headquartered in Foster City, California, Gilead has operations in North, South and Central America, Europe, Africa, Asia, and Australia. Gilead makes it a priority to increase access to its medicines for people who can benefit from them, regardless of where they live or their economic status.

Director, U.S. Therapeutic Area Policy, Virology

The Director, U.S. Virology Therapeutic Area (TA) Policy, is a strategic role within the matrixed U.S. Policy team as well as Gilead's broader Government Affairs (GA) organization and will be focused on developing policy solutions for the company's portfolio of innovative, life-saving Virology (HIV, Liver Disease and COVID-19) medicines. This position reports to the Senior Director of U.S. Therapeutic Area Policy and can be based in DC or Foster City, CA.

Responsibilities:

Serve as a policy expert to GA Virology teams and cross-functional teams by assessing external risks and trends in the policy environment and identifying policy objectives and positions of greatest impact to Gilead's Virology portfolio. Support the development of proactive, pro-patient Virology policy positions and solutions that are both commercially relevant and achievable.Work in collaboration with GA TA Strategy teams, GA geographic teams (e.g., Federal or State Government Affairs) and cross-functional colleagues (e.g., Commercial, Legal, Medical Affairs, Public Affairs) to align on priorities, objectives, and a strategy to amplify the work.Serve as a resource to the Senior Director of Therapeutic Area Policy, GA Virology TA Strategy Lead and U.S. commercial leads.Conduct policy research and analyze relevant reports, peer-reviewed journal articles, and legislative/regulatory proposals pertaining to Virology policy.Develop evidence-based messaging and impactful resources (e.g., talking points, position papers, memos, infographics, etc.) to advance Gilead's U.S. Virology objectives.Amplify Gilead's policy priorities in appropriate settings.Lead and manage multiple workstreams and deliverables to produce high quality, relevant and timely initiatives that are aligned with business and stakeholder needs.


Essential Qualifications:

B.S. or B.A. degree and minimum 12 years of relevant public or private sector experience in the healthcare industry, or combination of experience and any related advanced degree in public policy, public administration, public health, biotechnology, or a related field.Deep knowledge of U.S. federal and state healthcare policy (Medicare, Medicaid, etc.) is required. Understanding of the pharmaceutical industry, and HIV, Liver Disease and/or COVID-19 policy landscapes is preferred.Demonstrated experience developing and driving policy positions and strategies that support business priorities and patient access. Experience influencing policy change at the federal and/or state levels is strongly preferred.Excellent verbal, analytical, written and interpersonal communications skills, particularly in interpreting and communicating complex technical information (e.g., peer-reviewed journal articles, policy reports, legislation, regulations, etc.) for general audiences.Exceptional organizational and project management skills, high attention to detail and demonstrated ability to independently manage multiple workstreams and initiatives.Willingness to travel up to 25%.


Preferred Qualifications: 

Prior pharmaceutical or device industry experience or experience within government agencies is preferred.Advanced degree in public policy, health policy, public health, or health economics.


The salary range for this position is: $201,025.00 - $260,150.00. Gilead considers a variety of factors when determining base compensation, including experience, qualifications, and geographic location. These considerations mean actual compensation will vary. This position may also be eligible for a discretionary annual bonus, discretionary stock-based long-term incentives (eligibility may vary based on role), paid time off, and a benefits package. Benefits include company-sponsored medical, dental, vision, and life insurance plans*.

For Additional Benefits Information, Visit:

https://www.gilead.com/careers/compensation-benefits-and-wellbeing

 Eligible employees may participate in benefit plans, subject to the terms and conditions of the applicable plans.


For Jobs In The United States:

As an equal opportunity employer, Gilead Sciences Inc. is committed to a diverse workforce. Employment decisions regarding recruitment and selection will be made without discrimination based on race, color, religion, national origin, gender, age, sexual orientation, physical or mental disability, genetic information or characteristic, gender identity and expression, veteran status, or other non-job related characteristics or other prohibited grounds specified in applicable federal, state and local laws. In order to ensure reasonable accommodation for individuals protected by Section 503 of the Rehabilitation Act of 1973, the Vietnam Era Veterans' Readjustment Act of 1974, and Title I of the Americans with Disabilities Act of 1990, applicants who require accommodation in the job application process may contact ApplicantAccommodations@gilead.com for assistance.

For more information about equal employment opportunity protections, please view the 'Know Your Rights' poster.

NOTICE: EMPLOYEE POLYGRAPH PROTECTION ACT

YOUR RIGHTS UNDER THE FAMILY AND MEDICAL LEAVE ACT

PAY TRANSPARENCY NONDISCRIMINATION PROVISION

Our environment respects individual differences and recognizes each employee as an integral member of our company. Our workforce reflects these values and celebrates the individuals who make up our growing team.

Gilead provides a work environment free of harassment and prohibited conduct. We promote and support individual differences and diversity of thoughts and opinion.

For Current Gilead Employees And Contractors:

Please log onto your Internal Career Site to apply for this job.

jeid-b882f2df1d53584ca08555ae3c4e7109","Foster City, CA",424124.0,5.0,Full-time,OffsiteApply,Director,www.biospace.com,0,96125.0,2025-11-18 03:44:52
