job_id,company_name,title,description,location,company_id,views,formatted_work_type,application_type,formatted_experience_level,posting_domain,sponsored,zip_code,ingestion_time
3904721104,Azenta Life Sciences,Biorepository Site Manager,"How You’ll Add Value

The Biorepository Site Manager is responsible for ensuring that all functions related to processing samples are completed accurately and according to SOPs. The incumbent is responsible for helping others and ensuring that customer interests are considered.

What You’ll Do

Manage day to day operations over the site, which includes but not limited to, lab operations, facilities, people management, and vendor management. Communicate with key stakeholders across the organization to leverage functional expertise of the organization Serve as the primary contact for key site customers and act as technical lead Provide sample management subject matter expertise to current and potential clients Ensure customer expectations are met and site activities are in compliance with the quality management system Manage all aspects of site- including personnel, productivity, general inventory, departmental metrics, and resources. Enforce all policies and procedures with attention to Quality compliance. Effectively communicate all departmental affairs as needed and provide data, reports, and documentation as requested. Communicate regularly with sales account managers and develop relationships with targeted clients. Oversee receipt of packages, sample data entry, accessioning of samples, labeling samples, and assigning storage locations to samples as needed. Respond to after-hours emergencies to ensure integrity of the facility and products are maintained. Ensure all service/process failures are identified, investigated, and resolved appropriately. Proactively manage and drive the resolution of client issues. Recognize, escalate, and ensure resolution of operational, quality, or financial concerns of department. Initiate and revise documentation in accordance with SOPs. Ensure all weekly, monthly, and daily maintenance is completed per SOPs. Promote culture of continuous process improvement by leading, participating, and implementing improvements.

Responsibilities

Your Management Responsibilities 

Hiring & Staffing

Skills assessmentResource planningCompetency based, quality hiringEffective on-boarding


Customer Focus

Meet or exceed customer expectationsRespond to customer inquiries with urgencyEnsure key performance and quality indicators are met


Collaboration

Constructive conflictAppropriate follow-upHolds self and others accountableBuilds relationships & partners across-functionsConsiders and communicates cross-functionally


Communication to Inspire & Empower

Regular meaningful communicationsConnection of department & individual purpose to strategic directionFollow-up to address obstacles


Performance Management

Reinforce behaviors that drive resultsAssess -right person in the right jobFeedback/coachingRaising the bar; increasing contributionAddress misaligned or misplaced talent


Develop People

Dialogue about skills & behaviors for success at AzentaUnderstanding employee aspirationsOpportunities for experiential learning & growthExperience planning & delegate to develop


What You Will Bring

Bachelor’s degree in Life Sciences strongly preferred2+ years of people leadership experience2+ years’ experience in sample management or related activity2+ years of experience in a life science related regulated industry (CLIA, CAP, GMP, GTP, GLP, BoP)Previous biobank experience highly preferredHigh level of initiative and ability to work independently while keeping closely connected to the rest of the organizationStrong communication and interpersonal skillsProven customer service skillsDrives change, influence in leading a team and/or team coordinationAbility to multi-task and deliver on multiple priorities


Physical Requirements

Reaching/lifting/bendingAbility to lift up to 50 lbs.Extended periods of standing or sittingRight- and left-hand finger dexterityAbility to discern colors or use of color correction glassesAbility to work with refrigerants (e.g., dry ice and LN2) using proper PPE


Your Working Conditions: 

Employee will be working on an area with potentially infectious materials. Employee will be responsible for maintaining a clean work environment and enforce and follow universal precautions for bloodborne pathogens when working in an area considered to be potentially contaminated.

EOE M/F/Disabled/VET

Azenta Life Sciences is committed to creating a diverse environment and is proud to be an Equal Opportunity Employer.

As an Equal Opportunity Employer, we do our utmost to ensure that there is no discrimination or bias against anyone applying for a job or in any phase of employment for reasons related to race, color, religion, gender, national origin or ancestry, age, disability, veteran status, military service, sexual orientation, genetic information, or gender identity.


We welcome and value diversity, to ensure that our work benefits from a broad range of viewpoints and perspectives. Our growing global reach gives us the opportunity to bring to our business an even richer diversity of experiences and capabilities. For assistance in the application process, please reach out to Recruiting@azenta.com or call (978) 262-2400. Review EEO Poster Know Your Rights: WOrkplace Discrimination is Illegal (dol.gov)

Azenta Life Sciences participates in E-Verify®, and will provide the United States Federal Government with your form I-9 information to confirm you are authorized to work in the United States. For more information, please visit E-Verify® at www.dhs.gov/E-Verify. E-Verify® is a registered trademark of the U.S. Department of Homeland Security.

The contractor will not discharge or in any other manner discriminate against employees or applicants because they have inquired about, discussed, or disclosed their own pay or the pay of another employee or applicant. However, employees who have access to the compensation information of other employees or applicants as a part of their essential job functions cannot disclose the pay of other employees or applicants to individuals who do not otherwise have access to compensation information, unless the disclosure is (a) in response to a formal complaint or charge, (b) in furtherance of an investigation, proceeding, hearing, or action, including an investigation conducted by the employer, or (c) consistent with the contractor’s legal duty to furnish information.


41 CFR 60-1.35(c)","Cleveland, OH",80092649.0,3.0,Full-time,OffsiteApply,Mid-Senior level,careers.azenta.com,0,44102.0,2025-11-18 03:44:52
3888007767,Hyatt Hotels Corporation,Empleado de apoyo (Houseperson) al Departamento de Servicios de Convenciones,"Organization- Hyatt Regency Green Bay

Resumen

En Hyatt, nosotros creemos que nuestros huéspedes escogen a Hyatt por la atención que les brindan nuestros empleados, quienes se enfocan en proporcionar un servicio eficiente y una experiencia inolvidable.

El empleado de apoyo al Departamento de Servicios de Convenciones es responsable del montaje y desmontaje de todas las mesas, sillas, agua, etc. de los salones de reuniones. Esta persona deberá tener buenos conocimientos de comunicación como también la habilidad de levantar peso moderado. En este puesto se trabaja a un ritmo muy rápido.

Los empleados de Hyatt trabajan en un ambiente que requiere un desempeño excepcional pero a su vez da grandes recompensas. Así sea oportunidades de carrera profesional, enriquecimiento de su trabajo o un ambiente de trabajo que le brinda apoyo, si usted esta listo para el reto, entonces nosotros estamos listo para usted.","Green Bay, WI",220336.0,8.0,Full-time,OffsiteApply,Entry level,careers.hyatt.com,0,54301.0,2025-11-18 03:44:52
3901988946,Core-Mark International,Warehouse Associate - Forklift (Days),"We Deliver the Goods:

Competitive pay and benefits, including Day 1 Health & Wellness Benefits, Employee Stock Purchase Plan, 401K Employer Matching, Education Assistance, Paid Time Off, and much moreGrowth opportunities performing essential work to support America’s food distribution systemSafe and inclusive working environment, including culture of rewards, recognition, and respect

Why Join Core-Mark?

Core-Mark emphasizes personal growth and development for all associates. We believe that when you succeed, the company succeeds. We promote internally whenever possible and provide frequent training opportunities in several formats to help you meet your personal and career goals.

Start Pay: $16.50 an hour PLUS incentive pay based on performance Shift: Monday - Friday starting at 5am until finished

Position Purpose: 

The Forklift Operator, transports incoming freight to inventory from staging areas for storage in the appropriate slots, on the multi-level racks in the assigned warehouse area and replenish/re-stock pick slots in a timely manner ensuring all safety, Good Manufacturing Practices (GMP) and quality standards are met and to maintain the efficient flow of the production process Functions as a team member within the department and organization, as required, and perform any duty assigned to best serve the company.

Responsibilities may include, but not limited to:

Locates proper slot on storage racks, set pallets in place with forklift or hand stack items, enter product data and location into appropriate unit. Locates and performs count check of incoming freight in the staging area and transport to freezer with forklift/pallet jack. Replenishes pick slots with outgoing stock items according to next day’s work orders. Rotates date-sensitive stock to the front of the rack and/or remove outdated out of date inventory according to company policy. Disperses over-stocked items to available slots for temporary storage. Removes empty pallets, cardboard packing, and strapping to the proper area or receptacles. Inspects empty pallets for damage, stack and move pallets with pallet jack or forklift to the proper storage area. Follows all preferred work methods, safety policies and procedures per company guidelines. Ensure work area is safe and report any unsafe conditions and/or acts immediately. Reviews work schedule, perform safety check on equipment, obtain supplies required to perform the work and prepare for operations. Puts on all required Personal Protective Equipment and Safety Gear. Meets required productivity and accuracy standards per location and company guidelines. Works from receiving sheets, computer print-out, established procedures and practices, written and/or verbal instructions. Inspects items for damage, perform temperature and quality checks and take appropriate action as needed. Performs general housekeeping duties in work area as needed. Removes batteries requiring recharging, replace with charged batteries and complete vehicle inspection checklist. Secures all equipment and complete all necessary paperwork at the end of the shift. Performs other related duties as assigned. 

#CM-TA

Qualifications

 High School Diploma/GED or Equivalent 6+ months of warehouse and/or distribution work experience Must have stand-up reach experience Must be able to work the scheduled / assigned times and required overtime for the position Able to stand, walk, reach, and lift repeatedly throughout shift Able to lift, stack, and/or pull products off shelves, as well as replenish product, from various heights weighing between 10-35 pounds and generally up to between approximately 60 and 90 pounds, depending on the location, throughout shift Able to work in multi-temperature environments, i.e., cooler, freezer and dry Pass post offer drug test and criminal background check","Fort Worth, TX",28352.0,6.0,Full-time,OffsiteApply,Entry level,sjobs.brassring.com,0,76102.0,2025-11-18 03:44:52
3904958614,Tractor Supply Company,Team Leader,"Overall Job Summary

The Team Leader is responsible for assisting the Store Manager and Assistant Store Manager with the execution of operational, sales, and merchandising objectives by delivering a Legendary Customer Experience. The Team Leader is also responsible for promoting a safe and productive work environment for all Team Members, customers, and vendors, as well as training Team Members on the appropriate application of policies and procedures.

Do you love the life out here and want to share it with others? At Tractor Supply we strive to make the life out here a little bit better each day for both our neighbors and our teams.

Essential Duties and Responsibilities (Min 5%)

It is essential that you be available, flexible, adaptable, and service-oriented, as you must be able to fulfill all of the following requirements:

Maintain regular and predictable attendance. Work scheduled shifts, and have the ability to work varied hours, days, nights, weekends, and overtime as dictated by business needs. Uphold and promote a safe and productive work environment by following and enforcing policies and procedures. Deliver on our promise of Legendary Customer Service through GURA:Greet the Customer. Uncover Customer’s Needs & Wants. Recommend Product Solutions. Ask to Add Value & Appreciate the Customer. The Team Leader is required to perform a combination of the following duties during 95 percent of their day. Although the mix may vary from one day to another, our business and staffing model makes it essential that every person in the Team Leader position be able to perform all of the following duties accurately, efficiently and safely on a regular basis and without advance notice:Execute assigned basic, promotional, and seasonal merchandising activities. Perform Opening/Closing procedures. Transport and make deposits to bank. Assess store conditions and assign duties. Organize and prioritize workflow through the use of the daily planner. Recovery of merchandise. Participate in mandatory freight process. Perform regular and promotional price change activities. Resolve customer complaints/issues and ensure the customer has a Legendary shopping experience that differentiates from the competition. Adhere to loss prevention standards and respond to any alarm calls as needed. Communicate with Team Members on job functions, responsibilities and financial goals. Operate cash register/computer supervising cash handling procedures. Assist Team Members on appropriate application of policies and procedures. Ensure the safety and well-being of birds. Sanitize and maintain poultry holding tanks and care for birds as required. Operate Forklift and Baler. Complete all documentation associated with any of the above job duties. May be required to perform other duties as assigned. 

Required Qualifications

Experience: Retail experience and/or farming, ranching, pet/equine, or welding knowledge is strongly preferred. Supervisory experience preferred. Must be at least 18 years of age and possess a valid driver’s license.

Education : High school diploma or equivalent is preferred, but not required. Regardless of education level, you must be able to read, write, and count accurately.

Preferred Knowledge, Skills Or Abilities

Basic computer skills.

Ability to read, write, and count accurately.

Strong interpersonal skills and ability to resolve issues ethically and with minimal conflict.

Ability to perform and execute principle responsibilities of Team Members.

Working Conditions

Working environment is favorable, generally working inside with moderate noise. Work shifts vary from one store to another, but generally are no less than 4 hours and may exceed 8 hoursPromote a safe and productive work environment for Team Members and customers and adhere to Company safety training and guidelinesIndoor floors and outdoor lots generally are hard surfaces (concrete, asphalt, etc.) lighting and temperature are adequate. Ability to work outdoors in adverse weather conditions. 

Physical Requirements

Ability to move and transfer merchandise, weighing up to 50 pounds, throughout the store. Ability to push and pull merchandise up to 2,000 pounds with the assistance of proper material handling equipment (e.g. pallet jack). Ability to occasionally lift or reach merchandise overhead. Ability to frequently stand, kneel, twist, crouch, squat, bend, stoop, and climb ladders. Ability to move throughout the store for an entire shift. Ability to safely access all areas of the store including selling floor, side lot, stock area, and register area. Ability to operate and use all equipment necessary to run a store (e.g. dolly, handtruck, forklift, baler, computer, cash register) (forklift and baler requirements do not apply if under the age of 18). Ability to constantly operate store equipment such as computer, cash register, and other store equipment. Ability to read, write, and count accurately to complete all documentation. Ability to utilize strong written and verbal communication skills to communicate effectively with team members and customers. Ability to process information / merchandise through the point-of-sale system. Ability to handle and be in contact with birds/poultry. Ability to successfully complete training and certification to dispense propane, and to dispense propane (propane certification and dispensing requirement does not apply if under the age of 18). Ability to successfully complete all required training. Ability to travel as required in support of district needs. Ability to drive or operate a vehicle for business needs. This position is non-sedentary. 

Disclaimer

This job description represents an overview of the responsibilities for the above referenced position. It is not intended to represent a comprehensive list of responsibilities. A team member should perform all duties as assigned by his/ her supervisor.","Hazlehurst, MS",15434.0,5.0,Temporary,OffsiteApply,Mid-Senior level,www.tractorsupply.careers,0,39083.0,2025-11-18 03:44:52
3904379982,Ameris Bank,Marketing Specialist,"Ameris Bank is a purpose-driven company, dedicated to bringing financial peace of mind to communities, one person at a time. Whether a customer wants to grow their business, buy a home, or feel confident in their retirement plan, they have a partner in Ameris Bank. We serve customers in our locations across the Southeast, Mid-Atlantic and nationwide through our extensive digital offerings and mobile app.

Delivering financial peace of mind starts with a team that values integrity and rewards ingenuity. At Ameris, you’ll find teammates who are inclusive, collaborative problem-solvers who go the extra mile to support one another and to meet every customer’s needs. When teammates are empowered and bring their diverse perspectives to the table, we create the best possible outcomes for our customers. At Ameris, we know that a growth mindset is key for high performance and fosters an environment that prioritizes continuous improvement. Teammates have access to Employee Resource Groups that serve as advocates and allies as well as professional development opportunities to drive ongoing education. Learn more about our purpose and how you can bring it to life as an Ameris Bank teammate.

Responsible for supporting mortgage marketing efforts for the assigned region, focusing heavily on content and managing requests. Marketing efforts to be supported will include both company-wide marketing and individual Loan Officer marketing. The activities may include mailings, emails, digital and email campaigns, events, social media, promotional items, and administrative/budgetary support. Other duties assigned include: creating new loan program content pieces, on-boarding, training, and supporting Loan Officers on Total Expert or perspective email automation tool. Other duties as assigned.

Essential Functions, Duties, And Responsibilities

 Execute marketing plan as created by Marketing Director and Specialty Marketing Manager as it relates to the assigned region. Coordinate the creation of all new and updated product and program flyers. Coordinate with the compliance department to make sure that all marketing within the company is within compliance guidelines. Manage the development and implementation of all mortgage marketing strategies within Marketplace, Total Expert, and/or Encompass. Train existing personnel and new hires on using all CRM and other marketing systems. Order, allocate, track and bill marketing collateral. Support company events with a variety of activities from coordinating vendors to creating and tracking invitations. Ensure overall brand consistency across all marketing platforms. Personalize email, print and website material as needed. Enforce marketing policies. Create, update, and personalize marketing materials using Adobe Creative Suite. Maintain marketing files for the assigned sales teams. Research and assist with the selection of marketing vendors. Work with internal teams across the organization to ensure all marketing content meets legal and compliance requirements. Moderation of on-boarding, training and supporting all LO’s within the mortgage marketing budget and manages volunteers for events.

Required Knowledge, Skills And Competencies

 Proficient in all Microsoft Office package software including Word, Excel, Outlook, PowerPoint, etc. Excellent consulting, writing, editing (photo/video/text), presentation and communication skills. Detail-oriented and able to handle multiple jobs concurrently. Works as a team-player with a willingness to do whatever it takes to get the job done. Experience with Adobe Creative Suite.

Industry And Work Experience

 3-6 years’ of industry related experience.

Academic

 High school diploma or GED required. Bachelor’s degree or equivalent combination of education/experience in marketing, mixed media, hospitality, or similar.

Benefits Available To Employees

Ameris Bank provides a comprehensive employee benefit package to all eligible employees.

Medical, Dental and Vision InsuranceAmeris Bank absorbs a major portion of the cost of healthcare. You become eligible for coverage on the first of the month following 30 days of employmentLife Insurance provided at no additional cost to employeesAccidental Death & Dismemberment CoverageLong-Term Disability CoveragePaid Sick and Vacation Leave11 HolidaysVolunteer/Service DayEmployee Stock Purchase Plan401(k) Retirement PlanAmeris Bank matches 50% of your first 8% of contributions to the planFlexible Spending AccountsHealth Savings AccountHealth Reimbursement ArrangementSupplemental Life & Other Insurance PlansIdentity Theft ProtectionPet InsuranceLegal InsuranceEmployee Assistance ProgramEmployee Advocacy Program Tickets at Work (Entertainment discounts for Ameris Bank Employees)Wellness Discounts for Medical Premiums and Other Rewards Employee Referral IncentiveEducation AssistanceEmployee Resource Groups 

Banking Advantages For Employees

In addition to a wide array of benefits, Ameris Bank employees are also eligible for special bank services.

Free Interest CheckingFree Safe Deposit BoxFree Money Orders, Travelers’ Checks and Cashier ChecksDiscount on Mortgage Origination FeeFree Online Banking and Free Unlimited Online Bill PaymentEmployee Banking Perks

Disclaimer

The above job description is meant to describe the general nature and level of work being performed; it is not intended to be construed as an exhaustive list of all responsibilities, duties, and skills required for the position.

All job requirements are subject to possible modification to reasonably accommodate individuals with disabilities. Some requirements may exclude individuals who pose a direct threat or significant risk to the health and safety of themselves or other employees.","Atlanta, GA",1511193.0,91.0,Full-time,OffsiteApply,Associate,recruiting.ultipro.com,0,30303.0,2025-11-18 03:44:52
