job_id,company_name,title,description,location,company_id,views,formatted_work_type,application_type,formatted_experience_level,posting_domain,sponsored,zip_code,ingestion_time
3890894241,James G. Davis Construction (DAVIS),Senior Estimating + Preconstruction Engineer,"Category

Employment Opportunities

Job Location

Rockville

Tracking Code

853-823

Position Type

Full-Time/Regular

Intro

DAVIS Construction is the largest general contractor that solely serves the MidAtlantic region, with offices in Rockville, MD and Philadelphia, PA. Voted on by our employees, DAVIS has been consistently recognized as a Best Place to Work by the Washington Business Journal since the program's inception in 2007. At DAVIS, we embrace and value diversity as a strength and are committed to intentionally building a workplace where our employees are provided the necessary support to be successful. We became an employee-owned company in 1990 and still are today, sharing profits with our employees through our Employee Stock Ownership Plan (ESOP).

DAVIS is seeking a Senior Estimating + Preconstruction Engineer responsible for assisting the preconstruction and estimating teams in pursuing work through the development of proposal responses, providing preconstruction services, preparing competitive bid responses, and compiling Guaranteed Maximum Price (GMP) presentations for negotiated projects.

Here’s What You Get To Do

Assist in making development projects progress to the construction phaseCollaborate with Project teams to assist with establishing comprehensive construction cost estimates and final pricing packages incorporating operations standardsParticipate in budget/bid assemblyWrite scopes and develop qualifications Solicit and review bids from trade partners and material suppliersAnalyze submitted responses to identify missing scope, listed qualifications, noted exclusions and work to compare equivalent bid submissionsSecure sufficient trade partner coverage by effective communication and managementOpportunity to perform quantity take off for a variety of building components and systemsInfluence the project design to meet owner goalsBe part of a team environment and set the tone to impact the project and the greater good of the DAVIS culture and success for allYear-round opportunities for networking and volunteering in the communities we work inGrow trade partner relationships

Here’s who you are: (required)

3+ years’ experience in estimating or preconstruction for commercial construction in a variety of a market sectors. Strong communicator, both verbal and written, with ability to interact effectively at all levels within the organizationOnboarding will take place in our Rockville office and will be hybrid thereafterPlan reading experience

 Here’s what we love for you to have: (preferences)

Experience presenting pricing information to clients.Experience in Construction and Estimating with knowledge of local GC's and subcontractors. Strong understanding of local pricingAbility to build strong relationships with local trade partners.Quantity Take-off software experience (On Screen Take-off or Sketch-up preferred)PDF editor software experience (Brava or Bluebeam preferred)Experience estimating and providing preconstruction for Healthcare, Life Science or Multi-family projectsBachelor’s degree or related experience

For All Employees, We Value The Following Attributes

Safety – Consistently works within DAVIS safety standards; promotes safety as a priority with coworkers, subcontractors, and external clientsTeam Collaboration– Works effectively within their own team and across the organization; promotes team atmosphere and culture; has a positive, can-do attitudeCommitment to Quality – Applies DAVIS standards to produce high quality work on a consistent basis; produces work that is accurate and reliable, actively demonstrates excellence in service; builds and maintains integrity as a core function of their job and in their relationships with othersChampions DAVIS Business – Consistently markets DAVIS business within the scope of their job; actively seeks and / or supports new business opportunities; actively builds relationships and encourages others to do the same

We are not authorized to use a staffing agency or third-party vendors to fill this position.

EOE/M/F/D/V/SO","Rockville, MD",59720.0,4.0,Full-time,OffsiteApply,Entry level,jobs.silkroad.com,0,20850.0,2025-11-18 03:44:52
3889109994,Aya Healthcare,"Travel - PCU - Nurse Job - $2,791/wk - $2,980/wk","Aya Healthcare has an immediate opening for the following position: PCU Registered Nurse in Indianapolis, IN.

We’ll work with you to build the healthcare career of your dreams. Whether you want a job close to home or across the country, we’ve got you.

Requirements

Required Certifications: ACLS, BLSRequired Skills: Arterial line management, Blood Product Administration, Cardiac Telemetry, Central line care/management, Chest tubes-Emerson/Pleur-evac, External CPAP/BIPAP, Interpretation of dysrhythmias, IV insulin protocols, Manage Cardiac drips- no titration, Management of dysrhythmias, PCU/DOU/IMC/Stepdown, Peripheral Line Care/Management, Starting IVs, Surgical drains, Telemetry -on the unit monitoring, Titration of Insulin drips, Tracheostomy Management


Job Details

Pay: $2,791/week - $2,980/weekAssignment Length: 13-week assignmentShift: 4, 12-Hour 07:00 - 19:30At least one year of experience required


Aya delivers: 

The most jobs in the industry. We have the largest and most reliable job database, which means the jobs you see are open, updated in real time and ready for you!Competitive advantage over other agencies. Front-of-the-line access through our direct facility relationships — many with quick (even same-day) offers, giving you the best chance of securing your ideal opportunity.Expedited licensing and streamlined compliance. An industry-leading on-time start rate and strong relationships with boards of nursing across the country to accelerate the process in all 50 states.Expert career guidance. A dedicated recruiter to help you achieve your dream career. Travel, per diem, permanent — we have the reach and access to get you the jobs you want, and the expertise to help you realize your long-term goals.A best-in-class support system and an exceptional experience. Enjoy accurate, weekly pay, and an entire team dedicated to your happiness on assignment, 24/7.    


Plus, you get everything you expect from the largest healthcare staffing company in the industry:  

Exceptional benefits, including premium medical, dental, vision and life insurance beginning day one of your assignment. Want to take time off? Keep insurance coverage for up to 24 days between assignments.A generous 401(k) match.Paid company housing (we’ll help you bring your pets along, too!) or a generous housing stipend.Paid sick time in accordance with all applicable state, federal, and local laws. Aya’s general sick leave policy is that employees accrue one hour of paid sick leave for every 30 hours worked. However, to the extent any provisions of the statement above conflict with any applicable paid sick leave laws, the applicable paid sick leave laws are controlling.The industry’s only clinical ladder program for RNs on assignment.Access to unlimited continuing education units online.Licensure, relocation and other reimbursements, when applicable.Pay listed above includes taxable wages and tax-free expense reimbursements.


Aya is an Equal Employment Opportunity (""EEO"") Employer and welcomes all to apply.","Indianapolis, IN",808034.0,4.0,Contract,OffsiteApply,Mid-Senior level,www.ayahealthcare.com,0,46201.0,2025-11-18 03:44:52
3886476972,myGwork - LGBTQ+ Business Community,Commercial Card Relationship Manager - Payments - Vice President,"This inclusive employer is a member of myGwork – the largest global platform for the LGBTQ+ business community.  

You are excited to utilize your background in Payments and as a trusted advisor to make an impact. You have found the right team.

As a Commercial Card Relationship Manager you will be responsible for leading a portfolio of Corporate and Investment Bank Commercial Card clients with annual spend over $20 million. As a Commercial Card Relationship Manager, your primary objectives are to identify, plan, and implement payables strategies for growth and expansion, product cross sells, and account retention. You will cultivate strong relationships with both the clients in their assigned portfolio and with internal partners to achieve growth and retention goals and to resolve product and service issues. It is your responsibility to maintain high customer satisfaction levels through consistent and meaningful contact, informative bi-annual/annual account reviews, regular sharing of best practices, partnering with service and operations teams to resolve issues, and leading structured spend optimization efforts.

Job Responsibilities

Develop and execute client expansion and retention strategiesFocus on overall client experience and scorecard objectives; exceeding satisfaction and profitability objectives.Lead solution development efforts within the portfolio that best addresses client needs, while coordinating the involvement of all necessary internal company stakeholders.Build strong internal partnerships and alignment with Corporate and Investment Bank Global Corporate Bankers and Treasury Services (TS)Have in-Depth knowledge of commercial card payment products along with understanding of the market landscape.Be a commercial card Subject Matter Expert that becomes a Trusted Advisor for clients and line of business partners.

Required Qualifications, Capabilities, And Skills

5+ years of experience in client account management and/or business development Strong financial acumen and analytic skillsExcellent presentation and communication skills, including experience presenting to C-Level executivesAbility to work independently with little professional guidanceStrong negotiation skillsAbility to travel for internal/external meetings as required

Preferred Qualifications, Capabilities, And Skills

Proven ability to innovate, problem solve, and develop customized solutions to client issues and challenges Exceptional presentation skills with ability to take command of an audienceExperience in successfully managing multiple complex client relationships concurrently Collaborative team player with vision to understand downstream impact of actionsExperience in Commercial Card industry","Elgin, IL",5240076.0,5.0,Full-time,OffsiteApply,Mid-Senior level,www.mygwork.com,0,60120.0,2025-11-18 03:44:52
3903840452,WSP in the U.S.,"Senior VP, Transportation Planning Lead","Job Description

The Opportunity

WSP is currently initiating a search for an Environmental Planning Lead for our Glastonbury, CT offices. Be involved in projects with our New England Advisory & Planning Team and be a part of a growing organization that meets our client’s objectives and solves their challenges.

The primary need is in the Connecticut market, and enhancing client contacts and growing business in Connecticut will be the main focus for the successful candidate. The successful candidate may also support business development and project delivery in other Northeast offices/market.

WSP employees actively champion Inclusion & Diversity programs and initiatives throughout the country at the national, regional, and local levels. Here in the Northeast region, we act on the company’s inclusion, diversity, equity, and belonging principles through a variety of committees that partner with professional organizations, lead STEM outreach in our communities, facilitate regular learning opportunities through Lunch & Learn discussions and weekly “Inclusion & Diversity Moments,” and promote Inclusion & Diversity throughout the office through a variety of initiatives designed to reduce bias and raise awareness. Upper management supports these initiatives and all employees are invited to join their local councils or apply to become an “Inclusion & Diversity Ambassador,” which brainstorm and implement the various initiatives and programs.

Your Impact

Grow and diversify project portfolio – the successful candidate will bring a clear vision and plan to grow the portfolio of projects, while also expanding into new areas. Identification of opportunities and a prioritized and specific approach to deliver them:Grow and maintain a large professional network through professional organizations and the attendance of client commission and committee meetingsNetwork and grow relationships at both a technical and policy level, considering both perspectives on behalf of our clientsIdentify and pursue project opportunities Identify and include junior staff in meaningful roles in client meetings and business development Identify and encourage opportunities for junior staff to grow in project management, strategic and business planning, and business development Responsible for the financial health of the planning practice in the Southern New England area. Lead project teams and manage projects:Manage project scope, schedule and budget of assignments provided by clientsPrepare and assure the quality of reports, publications, maps, presentations, memos, letters, and other project materialsAnalyze data and model results for their impact on public policy, project alternatives, and suitabilityMaintain familiarity with and conduct project activities in compliance with appropriate federal, state, and local regulationsOrganize and lead public meetings, social media, and project eventsManage client relations and serve as primary contact between clients and WSP, for project assignments and planning servicesParticipate in local American Planning Association and WTS organizations and activitiesMaintain ongoing familiarity with trends and emerging issues related to transportation, land use, economic development, and demographic shiftsCollaborate with professionals from a variety of disciplines to provide “trusted advisor” service and future ready solutions for clients.Exercise responsible and ethical decision-making regarding company funds, resources and conduct, and adhere to WSP’s Code of Conduct and related policies and procedures.Perform additional responsibilities as required by business needs. Who You Are

Required Qualifications

Bachelor’s Degree in Transportation Planning, Urban Planning, Environmental Planning, or a related field (or equivalent experience.)15+ years of Transportation Planning experience in a corporate environment. Knowledge of planning principles and practices Experience in NEPA, PEL, CEPA planning studiesKnowledge of principles and practice of research and data collectionExcellent computer skills, including Microsoft Excel, Access, Word, PowerPoint, and OutlookExcellent analytical, written, oral, and visual communication skillsAbility to think creatively and critically about planning issuesProven track record of successfully managing a pipeline of work for staffAbility to demonstrate a good understanding of how to leverage existing skillsets and an ability to incorporate existing staff into the pursuit of new projectsProject management expertiseAbility to demonstrate a consistent track record of delivering work on-time, on-budget, and can show repeat business with a client – ideally in increasing amounts and/or responsibilityStrong understanding of relevant transportation planning issues, including multimodal planning, smart growth development, transit-oriented development, pedestrian and bicycle planning,Complete Streets design, and transit planning.Ability to establish partnerships with internal and external project management, client representatives, government agencies, and other organizations.Experience preparing planning studies and technical reports for a variety of transportation and transit agenciesGood organizational skills, multi-tasking capabilities, and attention to detailAbility to work well independently and in a group settingExperience working with CTDOT, Connecticut COGs, and other local and regional private entities and public sector agenciesMember and active participant in industry organizations such as WTS, ULI, and APAMust successfully complete and pass WSP’s Motor Vehicle screening. Proven track record of upholding workplace safety and ability to abide by WSP’s health, safety and drug/alcohol and harassment policies.Strong ability to quickly adapt to change and demonstrate flexibility to a variety of schedules and hours to meet business needs.Occasional travel may be required depending on project-specific requirements.

Preferred Qualifications

M.A., M.S., or other advanced degreeCurrently an Officer or Chair in Professional OrganizationCompletion of Leadership or Advanced Management TrainingFamiliarity with the Rhode Island Department of Transportation (RIDOT), Rhode Island Public Transit Authority (RIPTA), Rhode Island Turnpike & Bridge Authority (RITBA), Rhode Island municipalities, and/or other potential Rhode Island clientsProven business development track record Professional licensures and accreditations, such as: AICP, P.E., etc. 

About Us

About WSP

WSP USA is the U.S. operating company of WSP, one of the world's leading engineering and professional services firms. Dedicated to serving local communities, we are engineers, planners, technical experts, strategic advisors and construction management professionals. WSP USA designs lasting solutions in the buildings, transportation, energy, water and environment markets. With more than 15,000 employees in over 300 offices across the U.S., we partner with our clients to help communities prosper.

www.wsp.com

WSP provides a flexible and agile workplace model while meeting client needs. Employees are also afforded a comprehensive suite of benefits including medical, dental, vision, disability, life, and retirement savings focused on providing health and financial stability throughout the employee’s career.

At WSP, we want to give our employees the challenges they seek to grow their careers and knowledge base. Your daily contributions to your team will be essential in meeting client objectives, goals and challenges. Are you ready to get started?

WSP USA (and all of its U.S. companies) is an Equal Opportunity Employer Race/Age/Color/Religion/Sex/Sexual Orientation/Gender Identity/National Origin/Disability or Protected Veteran Status.

The selected candidate must be authorized to work in the United States.

Notice To Third Party Agencies

WSP does not accept unsolicited resumes from recruiters, employment agencies, or other staffing services. Unsolicited resumes include any resume or hiring document sent to WSP in the absence of a signed Service Agreement where WSP has expressly requested recruitment/staffing services specific to the position at hand. Any unsolicited resumes, including those submitted to hiring managers or other business leaders, will become the property of WSP and WSP will have the right to hire that candidate without reservation – no fee or other compensation will be owed or paid to the recruiter, employment agency, or other staffing service.","Glastonbury, CT",468782.0,5.0,Full-time,OffsiteApply,Executive,emit.fa.ca3.oraclecloud.com,0,6033.0,2025-11-18 03:44:52
3889743646,Allied Universal,Surveillance Investigator,"Allied Universal® Compliance and Investigations, North America’s leading expert insurance claim investigations, compliance and corporate governance company, provides rewarding careers that give you a sense of purpose. While working in a dynamic, diverse and inclusive workplace, you will be part of a team that fuels a culture that will reflect in our communities and customers we serve. We offer medical, dental and vision coverage, life insurance, retirement plan, employee assistance programs, company discounts, perks and more for most full-time compliance and investigation jobs!

Allied Universal® is hiring a Surveillance Investigator. The Investigator’s primary focus is to investigate the insurance claims field for a variety of coverage to include workers’ compensation, general liability, property and casualty, disability, life, and healthcare. This individual must have investigative skills to independently conduct all aspects of basic surveillance investigations.

Remote work options!Flexible schedules!Auto and travel allowances!Statewide openings - apply to this ad!

Responsibilities

Independently investigate insurance claims field for a variety of coverage to include workers’ compensation, general liability, property and casualty, disability, life, and healthcare under close direct supervision Collect information through use of own discretion, and guidance from clients and case managers, by means of: Personal observation with video and photographic validation 

Qualifications

Must possess one or more of the following:A bachelor's degree in criminal justice, accounting, engineering, computer science, a foreign language, or a related fieldAn associate degree in criminal justice, accounting, engineering, computer science, a foreign language, or a related field with a minimum of two (2) years of experience in law enforcement, military law enforcement, or government/private investigationsMust be able to successfully complete the Allied Universal Investigations PI Training/orientation courseAbility to be properly licensed as required by the state Must possess a current and valid driver’s licenseFlexibility to work varied and irregular hours and days, including weekends and holidays 

Benefits

Pay Rate: $20 - $24 / hrAn Admin Rate of $15.74 / hr applies during the first two weeks of training and to all non-case activities such as Travel and Case preparationMedical, dental, vision, basic life, AD&D, and disability insurance Enrollment in our company’s 401(k)plan, subject to eligibility requirements Seven paid holidays annually and ten personaldays annually.Unused vacation is only paid out where required by law.Earnings are paid bi-weekly for every hour worked Fixed bi-weekly auto allowance provided to investigators Company credit card for all fuel, travel, and field related purposes Bonus eligible for monthly video submission up to $500 - based on performance Referral program offering a $500 bonus per referral

Allied Universal® is an Equal Opportunity Employer. All qualified applicants will receive consideration for employment without regard to race/ethnicity, age, color, religion, sex, sexual orientation, gender identity, national origin, genetic information, disability, protected veteran status or relationship/association with a protected veteran, or any other basis or characteristic protected by law. For more information: www.aus.com

If you have any questions regarding Equal Employment Opportunity, Affirmative Action, Diversity and Inclusion, have difficulty using the online system and require an alternate method to apply, or require an accommodation at any time during the recruitment and/or employment process, please contact our local Human Resources department. To find an office near you, please visit: www.aus.com/offices.","Seattle, WA",10696913.0,5.0,Full-time,OffsiteApply,Mid-Senior level,jobs.aus.com,0,98101.0,2025-11-18 03:44:52
3884819819,Solomon Page,CT Technologist - Radiology,"Our client is looking to add a CT Technologist to their team. As a CT Technologist, you will supply teams with the required images to direct patient care and diagnoses. CT Technologists will explain the CT scan process to patients, while maintaining the highest standards of care and procedures.

Job Details:

Location: Newport, Rhode Island Duration: 13 Weeks Start Date: 04/08/2024 Shift: 5x8 Days Estimated Gross Weekly Pay: $3,682

Qualifications: 

Current certification from an accredited nursing program Excellent interpersonal skills including patience, empathy, and compassion Effective communication skills, including active listening, writing, speaking and reading comprehension Fast and adaptive problem-solving abilities Ability to stand for long periods of time 

Why Work with Us

The success of Solomon Page is defined by our people. Healthcare providers are offered a comprehensive benefits program including a robust medical benefits package. Additionally, you are offered access to dental and vision coverage, commuter benefits, a 401(k) plan, flexible spending, referral bonuses, ongoing training, and more. Finally, as an ESOP company, Solomon Page offers an employee stock ownership plan to all consultants. As a member of our provider community, you will join a nurturing culture that fosters your career goals.

About Solomon Page Healthcare & Medical Staffing

Accredited by the Joint Commission with the Gold Seal of Approval, Solomon Page prides ourselves in developing long-term relationships with healthcare providers based on trust and respect. Our experienced Healthcare and Medical Staffing experts are committed to providing safe and quality patient care through our wide network of travel nurses, locum tenens, and allied resources. For more information and additional healthcare opportunities, visit: solomonpage.com and connect with Solomon Page on Instagram, Facebook, Twitter, LinkedIn, and TikTok.

If you meet the required qualifications and are interested in this role, please apply today.

263707

","Newport, RI",14352.0,6.0,Contract,OffsiteApply,Mid-Senior level,opportunities.solomonpage.com,0,2840.0,2025-11-18 03:44:52
